<xs:schema xmlns:xs="http://www.w3.org/2001/XMLSchema">

    <xs:element name="products">
        <xs:complexType>
            <xs:sequence>
                <xs:element name="product" type="product_d" minOccurs="0" maxOccurs="unbounded" />
            </xs:sequence>
        </xs:complexType>
    </xs:element>

    <xs:complexType name="product_d">
        <xs:sequence>
            <xs:element name="id" type="xs:int" />
            <xs:element name="name" type="xs:string" />
            <xs:element name="price" type="xs:decimal" />
            <xs:element name="description" type="xs:string" />
        </xs:sequence>
    </xs:complexType>
</xs:schema>